{
  "event_id": "018f2f6e-6b2a-7c31-9b1a-2f7e6a9c1d3e",
  "event_ts": "2026-07-25T08:00:00.125Z",
  "ingest_ts": "2026-07-25T08:00:00.410Z",
  "source_id": "LUX-BF-01-TC-H07-03",
  "asset_id": "LUX-BF-01",
  "plant_id": "NS-DEMO-LUX-01",
  "sequence": 48213,
  "correlation_id": "01J9Z8Q3K5F8E2X6R7T4V0M1N2",
  "schema_name": "novasteel.telemetry.v1",
  "schema_version": 1,
  "data_classification": "SYNTHETIC",
  "privacy_label": "DEMO-NONPERSONAL",
  "scenario_id": "demo-full",
  "seed": 240725,
  "generator_version": "novasteel-sim/1.0.0",
  "payload": {
    "type": "telemetry.furnace.thermal",
    "sensor_id": "LUX-BF-01-TC-H07-03",
    "signal_code": "hearth_shell_temperature",
    "value": 142.7,
    "unit": "Cel",
    "quality": "GOOD",
    "uncertainty": 0.6,
    "sample_period_ms": 5000
  }
}
