{
  "event_id": "018f2f6e-6b2a-7c31-9b1a-2f7e6a9c1d50",
  "event_ts": "2026-07-25T08:03:00Z",
  "ingest_ts": "2026-07-25T08:03:00.120Z",
  "source_id": "LUX-BF-01-RUL",
  "asset_id": "LUX-BF-01",
  "plant_id": "NS-DEMO-LUX-01",
  "sequence": 48215,
  "correlation_id": "01J9Z8Q3K5F8E2X6R7T4V0M1N2",
  "schema_name": "novasteel.model-inference.v1",
  "schema_version": 1,
  "data_classification": "SYNTHETIC",
  "privacy_label": "DEMO-NONPERSONAL",
  "scenario_id": "demo-full",
  "seed": 240725,
  "generator_version": "novasteel-sim/1.0.0",
  "payload": {
    "type": "model.inference",
    "inference_id": "INF-LUX-BF01-20260725T0803Z",
    "model_id": "lining-rul-piml",
    "model_version": "1.3.0-demo",
    "feature_snapshot_ts": "2026-07-25T08:03:00Z",
    "component_id": "HEARTH-SECTOR-07",
    "prediction": {
      "remaining_useful_life_days_p50": 21.0,
      "remaining_useful_life_days_p10": 16.8,
      "remaining_useful_life_days_p90": 27.5,
      "estimated_minimum_lining_mm": 344,
      "risk_score": 0.87,
      "severity": "HIGH"
    },
    "top_factors": [
      {
        "feature": "heat_flux_6h_slope",
        "contribution": 0.29
      }
    ],
    "label": "degraded_lining"
  }
}
