{
  "event_id": "018f2f6e-6b2a-7c31-9b1a-2f7e6a9c1d54",
  "event_ts": "2026-07-25T08:30:00Z",
  "ingest_ts": "2026-07-25T08:30:00.100Z",
  "source_id": "LUX-SYNTHETIC-LAB",
  "asset_id": "LUX-HSM-01",
  "plant_id": "NS-DEMO-LUX-01",
  "sequence": 48217,
  "correlation_id": "01J9Z8Q3K5F8E2X6R7T4V0M1N2",
  "schema_name": "novasteel.quality-measurement.v1",
  "schema_version": 1,
  "data_classification": "SYNTHETIC",
  "privacy_label": "DEMO-NONPERSONAL",
  "scenario_id": "quality-drift",
  "seed": 240728,
  "generator_version": "novasteel-sim/1.0.0",
  "payload": {
    "type": "quality.measurement",
    "material_id": "COIL-LUX-260725-017",
    "heat_id": "H-LUX-260725-0042",
    "grade_code": "NS-AUTO-DP780",
    "sample_id": "LAB-260725-0091",
    "characteristic_code": "tensile_strength",
    "value": 801.2,
    "unit": "MPa",
    "lower_spec_limit": 780.0,
    "upper_spec_limit": 930.0,
    "measurement_method": "SYNTHETIC-LAB-TENSILE",
    "result_status": "PASS"
  }
}
